{"adjacency":[{"forward":[],"node_id":"4cc59666a045db50e8432ececd58ed30ae426a506defbf555566c0a558cdbc13","reverse":["715962216736b87b41a61602ad4d5e9482e2b6fb895741033fdd904b36189c4d"]},{"forward":["715962216736b87b41a61602ad4d5e9482e2b6fb895741033fdd904b36189c4d"],"node_id":"5e231222c6adb5fe154872b472d9133f0cb230ad4497e87d4ebc8ac8cd234130","reverse":[]}],"case_policy":"case-sensitive","edges":[{"certainty":"known","id":"715962216736b87b41a61602ad4d5e9482e2b6fb895741033fdd904b36189c4d","kind":"dependency","provenance":[{"locator":"docs/alpha.md:4","source":"metadata"}],"source":"5e231222c6adb5fe154872b472d9133f0cb230ad4497e87d4ebc8ac8cd234130","source_locator":"docs/alpha.md:4","target":"4cc59666a045db50e8432ececd58ed30ae426a506defbf555566c0a558cdbc13"}],"frozen_frequency_digest":"0000000000000000000000000000000000000000000000000000000000000000","graph_digest":"ffffffffffffffffffffffffffffffffffffffffffffffffffffffffffffffff","indexes":{"edges":[{"id":"715962216736b87b41a61602ad4d5e9482e2b6fb895741033fdd904b36189c4d","position":0}],"nodes":[{"id":"4cc59666a045db50e8432ececd58ed30ae426a506defbf555566c0a558cdbc13","position":0},{"id":"5e231222c6adb5fe154872b472d9133f0cb230ad4497e87d4ebc8ac8cd234130","position":1}]},"nodes":[{"authority":"canonical","content_digest":"2222222222222222222222222222222222222222222222222222222222222222","domains":["api","architecture"],"generated_status":"source","id":"4cc59666a045db50e8432ececd58ed30ae426a506defbf555566c0a558cdbc13","lifecycle":"current","owner":"core","path":"src/beta.rs","provenance":[{"locator":"src/beta.rs:1","source":"scanner"}],"source_type":"code"},{"authority":"canonical","content_digest":"1111111111111111111111111111111111111111111111111111111111111111","domains":["api","architecture"],"generated_status":"source","id":"5e231222c6adb5fe154872b472d9133f0cb230ad4497e87d4ebc8ac8cd234130","lifecycle":"current","owner":"core","path":"docs/alpha.md","provenance":[{"locator":"docs/alpha.md:1","source":"scanner"}],"source_type":"markdown"}],"parent_digest":"dddddddddddddddddddddddddddddddddddddddddddddddddddddddddddddddd","receipt":{"before_digest":"aaaaaaaaaaaaaaaaaaaaaaaaaaaaaaaaaaaaaaaaaaaaaaaaaaaaaaaaaaaaaaaa","candidate_digest":"bbbbbbbbbbbbbbbbbbbbbbbbbbbbbbbbbbbbbbbbbbbbbbbbbbbbbbbbbbbbbbbb","operation_id":"refresh-1","ordering_version":1,"published_digest":"cccccccccccccccccccccccccccccccccccccccccccccccccccccccccccccccc","validation_facts":["paths-contained","schema-v1"]},"scan_input_digest":"eeeeeeeeeeeeeeeeeeeeeeeeeeeeeeeeeeeeeeeeeeeeeeeeeeeeeeeeeeeeeeee","schema_version":1,"snapshot_digest":"942435066c93943869b8524d37217faaf2282b918c3c665b27ec8d8ec273e33d"}
